Enter password: ***********
Welcome to the MySQL monitor.  Commands end with ; or \g.
Your MySQL connection id is 10
Server version: 8.0.30 MySQL Community Server - GPL

Copyright (c) 2000, 2022, Oracle and/or its affiliates.

Oracle is a registered trademark of Oracle Corporation and/or its
affiliates. Other names may be trademarks of their respective
owners.

Type 'help;' or '\h' for help. Type '\c' to clear the current input statement.

mysql> drop database ORG;
Query OK, 3 rows affected (0.05 sec)

mysql> create database sb101day3;
Query OK, 1 row affected (0.01 sec)

mysql> use sb101day3;
Database changed
mysql> create table PROGRAMMER(
    -> EnpNo int(5) primary key,
    -> ProjId int(3),
    -> LastName varchar(30),
    -> FirstName varchar(30),
    -> HireDate date,
    -> Language varchar(15),
    -> TaskNo int(2),
    -> Privilege varchar(15)
    -> );
Query OK, 0 rows affected, 3 warnings (0.03 sec)

mysql> desc PROGRAMMER;
+-----------+-------------+------+-----+---------+-------+
| Field     | Type        | Null | Key | Default | Extra |
+-----------+-------------+------+-----+---------+-------+
| EnpNo     | int         | NO   | PRI | NULL    |       |
| ProjId    | int         | YES  |     | NULL    |       |
| LastName  | varchar(30) | YES  |     | NULL    |       |
| FirstName | varchar(30) | YES  |     | NULL    |       |
| HireDate  | date        | YES  |     | NULL    |       |
| Language  | varchar(15) | YES  |     | NULL    |       |
| TaskNo    | int         | YES  |     | NULL    |       |
| Privilege | varchar(15) | YES  |     | NULL    |       |
+-----------+-------------+------+-----+---------+-------+
8 rows in set (0.01 sec)

mysql> alter table PROGRAMMER change ProjId ProjId varchar(5);
Query OK, 0 rows affected (0.05 sec)
Records: 0  Duplicates: 0  Warnings: 0

mysql> insert into PROGRAMMER values(201, 'NPR','Gupta','Saurav', '1995-01-01', 'VB', 52, 'Secret');
Query OK, 1 row affected (0.01 sec)

mysql> insert into PROGRAMMER values(390,'KCW', 'Ghosh','Pinky' ,'1993-01-05', 'JAVA', 11, 'TopSecret');
Query OK, 1 row affected (0.00 sec)

mysql> insert into PROGRAMMER values(789, 'RNC', 'Agarwal', 'Praveen', '1998-08-03', 'VB', 11, 'Secret');
Query OK, 1 row affected (0.00 sec)

mysql> insert into PROGRAMMER values(134, 'TIPPS', 'Chaudhury', 'Supriyo', '95-07-15', 'C++', 52, 'Secret');
Query OK, 1 row affected (0.00 sec)

mysql> insert into PROGRAMMER values(896, 'KCW', 'Jha', 'Ranjit', '1997-05-15', 'JAVA', 10, 'TopSecret');
Query OK, 1 row affected (0.00 sec)

mysql> insert into PROGRAMMER values(345, 'TIPPS', 'John', 'Peter', '1999-11-15', 'JAVA', 52, null);
Query OK, 1 row affected (0.00 sec)

mysql> insert into PROGRAMMER values(563, 'NITTS','Anderson', 'Andy', '1994-08-15', 'C++', 89, 'Confidential');
Query OK, 1 row affected (0.01 sec)

mysql> select * from PROGRAMMER;
+-------+--------+-----------+-----------+------------+----------+--------+--------------+
| EnpNo | ProjId | LastName  | FirstName | HireDate   | Language | TaskNo | Privilege    |
+-------+--------+-----------+-----------+------------+----------+--------+--------------+
|   134 | TIPPS  | Chaudhury | Supriyo   | 1995-07-15 | C++      |     52 | Secret       |
|   201 | NPR    | Gupta     | Saurav    | 1995-01-01 | VB       |     52 | Secret       |
|   345 | TIPPS  | John      | Peter     | 1999-11-15 | JAVA     |     52 | NULL         |
|   390 | KCW    | Ghosh     | Pinky     | 1993-01-05 | JAVA     |     11 | TopSecret    |
|   563 | NITTS  | Anderson  | Andy      | 1994-08-15 | C++      |     89 | Confidential |
|   789 | RNC    | Agarwal   | Praveen   | 1998-08-03 | VB       |     11 | Secret       |
|   896 | KCW    | Jha       | Ranjit    | 1997-05-15 | JAVA     |     10 | TopSecret    |
+-------+--------+-----------+-----------+------------+----------+--------+--------------+
7 rows in set (0.00 sec)

mysql> update PROGRAMMER set Language  = 'C++' where ProjId = 'NPR';
Query OK, 1 row affected (0.00 sec)
Rows matched: 1  Changed: 1  Warnings: 0

mysql> select * from PROGRAMMER;
+-------+--------+-----------+-----------+------------+----------+--------+--------------+
| EnpNo | ProjId | LastName  | FirstName | HireDate   | Language | TaskNo | Privilege    |
+-------+--------+-----------+-----------+------------+----------+--------+--------------+
|   134 | TIPPS  | Chaudhury | Supriyo   | 1995-07-15 | C++      |     52 | Secret       |
|   201 | NPR    | Gupta     | Saurav    | 1995-01-01 | C++      |     52 | Secret       |
|   345 | TIPPS  | John      | Peter     | 1999-11-15 | JAVA     |     52 | NULL         |
|   390 | KCW    | Ghosh     | Pinky     | 1993-01-05 | JAVA     |     11 | TopSecret    |
|   563 | NITTS  | Anderson  | Andy      | 1994-08-15 | C++      |     89 | Confidential |
|   789 | RNC    | Agarwal   | Praveen   | 1998-08-03 | VB       |     11 | Secret       |
|   896 | KCW    | Jha       | Ranjit    | 1997-05-15 | JAVA     |     10 | TopSecret    |
+-------+--------+-----------+-----------+------------+----------+--------+--------------+
7 rows in set (0.00 sec)


mysql> delete from PROGRAMMER where LastName = 'Chaudhury' AND FirstName = 'Supriyo';
Query OK, 1 row affected (0.01 sec)

mysql> alter table PROGRAMMER drop column TaskNo;
Query OK, 0 rows affected (0.03 sec)
Records: 0  Duplicates: 0  Warnings: 0

mysql> create table Department
    -> (
    -> DeptNo int primary key,
    -> Dname varchar(20) NOT NULL,
    -> Loc varchar(20) NOT NULL
    -> );
Query OK, 0 rows affected (0.02 sec)

mysql> alter table Department modify Dname varchar(50);
Query OK, 0 rows affected (0.04 sec)
Records: 0  Duplicates: 0  Warnings: 0

mysql> insert into Department values
    -> (
    -> 10,
    -> 'ACCOUNTS',
    -> 'NEWYORK'
    -> );
Query OK, 1 row affected (0.00 sec)

mysql> insert into Department values
    -> (
    -> 20,
    -> 'MARKETING',
    -> 'CHICAGO'
    -> );
Query OK, 1 row affected (0.00 sec)

mysql> insert into Department values
    -> (
    -> 30,
    -> 'SALES',
    -> 'ATLANTA'
    -> );
Query OK, 1 row affected (0.01 sec)

mysql> insert into Department values
    -> (
    -> 40,
    -> 'RESEARCH',
    -> 'OHIO'
    -> );
Query OK, 1 row affected (0.01 sec)

mysql> Create table Employee(
    ->  EmpNo int Primary Key,
    ->  Ename varchar(20) NOT NULL,
    ->  Job varchar(20) NOT NULL,
    ->  Sal int NOT NULL,
    ->  Hiredate date NOT NULL,
    ->  Deptno int,
    ->  FOREIGN KEY (Deptno) references Department (Deptno)
    ->  );
Query OK, 0 rows affected (0.02 sec)

mysql> alter table EMPLOYEE add column MGR varchar(4);
Query OK, 0 rows affected (0.02 sec)
Records: 0  Duplicates: 0  Warnings: 0

mysql> insert into EMPLOYEE (EmpNo, Ename, Job, Sal, Hiredate, Deptno) values (
    -> 7001,
    -> 'JAMES',
    -> 'CLERK',
    -> 3000,
    -> str_to_date('6/5/2005','%d/%m/%Y'),
    -> 10
    -> );
Query OK, 1 row affected (0.01 sec)

mysql> insert into EMPLOYEE (EmpNo, Ename, Job, Sal, Hiredate, Deptno) values (
    -> 7002,
    -> 'MASON',
    -> 'PRESIDENT',
    -> 10000,
    -> str_to_date('6/6/2005', '%d/%m/%Y') ,
    -> 20
    -> );
Query OK, 1 row affected (0.00 sec)

mysql> insert into EMPLOYEE (EmpNo, Ename, Job, Sal, Hiredate, Deptno) values (
    -> 7003,
    -> 'CLARK',
    -> 'MANAGER',
    -> 5000,
    ->  str_to_date('6/5/2004', '%d/%m/%Y') ,
    -> 20
    -> );
Query OK, 1 row affected (0.00 sec)

mysql> insert into EMPLOYEE (EmpNo, Ename, Job, Sal, Hiredate, Deptno) values (
    -> 7004,
    -> 'JOHN',
    -> 'MANAGER',
    -> 6000,
    -> str_to_date('6/8/2005', '%d/%m/%Y') ,
    -> 10
    -> );
Query OK, 1 row affected (0.01 sec)

mysql> insert into EMPLOYEE (EmpNo, Ename, Job, Sal, Hiredate, Deptno) values (
    -> 7005,
    -> 'BLAKE',
    -> 'CLERK',
    -> 3500,
    -> str_to_date('6/9/2005', '%d/%m/%Y') ,
    -> 30
    -> );
Query OK, 1 row affected (0.01 sec)

mysql> Create table Grade
    -> (
    -> GradeNo int primary key,
    -> Hi_sal int NOT NULL,
    -> Lo_sal int NOT NULL
    -> );
Query OK, 0 rows affected (0.01 sec)

mysql> alter table Grade drop column Lo_sal;
Query OK, 0 rows affected (0.01 sec)
Records: 0  Duplicates: 0  Warnings: 0

mysql> alter table Grade add column Lo_sal int;
Query OK, 0 rows affected (0.02 sec)
Records: 0  Duplicates: 0  Warnings: 0

mysql> insert into Grade values (
    -> 1,
    -> 2000,
    -> 500
    -> );
Query OK, 1 row affected (0.01 sec)

mysql> insert into Grade values (
    -> 2,
    -> 3500,
    -> 2100
    -> );
Query OK, 1 row affected (0.01 sec)

mysql> insert into Grade values (
    -> 3,
    -> 6000,
    -> 3600
    -> );
Query OK, 1 row affected (0.01 sec)

mysql> insert into Grade values (
    -> 4,
    -> 15000,
    -> 6100
    -> );
Query OK, 1 row affected (0.01 sec)

mysql> create table EMPLOYEE_BACK (
    ->  EmpNo int Primary Key,
    ->  Ename varchar(20) NOT NULL,
    ->  Job varchar(20) NOT NULL,
    ->  Sal int NOT NULL,
    ->  Hiredate date NOT NULL,
    ->  Deptno int,
    ->  FOREIGN KEY (Deptno) references Department (Deptno)
    ->  );
Query OK, 0 rows affected (0.03 sec)

mysql>  create table EMPLOYEE_BACK as select * from EMPLOYEE;
ERROR 1050 (42S01): Table 'EMPLOYEE_BACK' already exists
mysql> create table EMPLOYEE_BACK as select * from EMPLOYEE;
ERROR 1050 (42S01): Table 'EMPLOYEE_BACK' already exists
mysql> create table EMPLOYEE as select * from EMPLOYEE_BACK;
ERROR 1050 (42S01): Table 'EMPLOYEE' already exists
mysql> create table EMPLOYEE_BACK1 as select * from EMPLOYEE;
Query OK, 5 rows affected (0.02 sec)
Records: 5  Duplicates: 0  Warnings: 0

mysql> drop table EMPLOYEE_BACK1;
Query OK, 0 rows affected (0.01 sec)

mysql> drop table EMPLOYEE_BACK;
Query OK, 0 rows affected (0.01 sec)

mysql> create table EMPLOYEE_BACK as select * from EMPLOYEE;
Query OK, 5 rows affected (0.02 sec)
Records: 5  Duplicates: 0  Warnings: 0

mysql> update Employee set Sal = 3500 where Ename = 'James';
Query OK, 1 row affected (0.01 sec)
Rows matched: 1  Changed: 1  Warnings: 0

mysql> update Employee set Sal = Sal + 1000 ;
Query OK, 5 rows affected (0.01 sec)
Rows matched: 5  Changed: 5  Warnings: 0

mysql> update Employee set Sal = Sal - 100 where DeptNo = 10;
Query OK, 2 rows affected (0.01 sec)
Rows matched: 2  Changed: 2  Warnings: 0

mysql> alter table EMPLOYEE add column COMM int;
Query OK, 0 rows affected (0.02 sec)
Records: 0  Duplicates: 0  Warnings: 0

mysql> update EMPLOYEE set COMM = 0;
Query OK, 5 rows affected (0.01 sec)
Rows matched: 5  Changed: 5  Warnings: 0

mysql> delete from EMPLOYEE where HireDate < str_to_date('2005-JUN-06', '%Y-%M-%d');
Query OK, 2 rows affected (0.00 sec)

mysql> delete from EMPLOYEE where Sal < 3000;
Query OK, 0 rows affected (0.00 sec)

mysql> select * from EMPLOYEE where DeptNo = 10;
+-------+-------+---------+------+------------+--------+------+------+
| EmpNo | Ename | Job     | Sal  | Hiredate   | Deptno | MGR  | COMM |
+-------+-------+---------+------+------------+--------+------+------+
|  7004 | JOHN  | MANAGER | 6900 | 2005-08-06 |     10 | NULL |    0 |
+-------+-------+---------+------+------------+--------+------+------+
1 row in set (0.01 sec)

mysql> select * from EMPLOYEE where DeptNo = 10 AND MGR IS NOT NULL;
Empty set (0.00 sec)

mysql> select * from EMPLOYEE where Sal BETWEEN 3000 AND 5000;
+-------+-------+-------+------+------------+--------+------+------+
| EmpNo | Ename | Job   | Sal  | Hiredate   | Deptno | MGR  | COMM |
+-------+-------+-------+------+------------+--------+------+------+
|  7005 | BLAKE | CLERK | 4500 | 2005-09-06 |     30 | NULL |    0 |
+-------+-------+-------+------+------------+--------+------+------+
1 row in set (0.00 sec)

mysql> select * from EMPLOYEE where Hiredate > str_to_date('10-July-2005','%d-%M-%Y');
+-------+-------+---------+------+------------+--------+------+------+
| EmpNo | Ename | Job     | Sal  | Hiredate   | Deptno | MGR  | COMM |
+-------+-------+---------+------+------------+--------+------+------+
|  7004 | JOHN  | MANAGER | 6900 | 2005-08-06 |     10 | NULL |    0 |
|  7005 | BLAKE | CLERK   | 4500 | 2005-09-06 |     30 | NULL |    0 |
+-------+-------+---------+------+------------+--------+------+------+
2 rows in set (0.01 sec)

mysql> select * from EMPLOYEE where Job = 'President' OR Job = 'MANAGER';
+-------+-------+-----------+-------+------------+--------+------+------+
| EmpNo | Ename | Job       | Sal   | Hiredate   | Deptno | MGR  | COMM |
+-------+-------+-----------+-------+------------+--------+------+------+
|  7002 | MASON | PRESIDENT | 11000 | 2005-06-06 |     20 | NULL |    0 |
|  7004 | JOHN  | MANAGER   |  6900 | 2005-08-06 |     10 | NULL |    0 |
+-------+-------+-----------+-------+------------+--------+------+------+
2 rows in set (0.00 sec)

mysql> select * from EMPLOYEE where (DeptNo = 10 OR DeptNo = 20) AND Job = 'MANAGER';
+-------+-------+---------+------+------------+--------+------+------+
| EmpNo | Ename | Job     | Sal  | Hiredate   | Deptno | MGR  | COMM |
+-------+-------+---------+------+------------+--------+------+------+
|  7004 | JOHN  | MANAGER | 6900 | 2005-08-06 |     10 | NULL |    0 |
+-------+-------+---------+------+------------+--------+------+------+
1 row in set (0.00 sec)

mysql> update EMPLOYEE set COMM = 500 where DeptNo = 10;
Query OK, 1 row affected (0.01 sec)
Rows matched: 1  Changed: 1  Warnings: 0

mysql> select * from EMPLOYEE where COMM IS NULL;
Empty set (0.00 sec)

mysql> select * from EMPLOYEE where Job = 'PRESIDENT' OR Job = 'MANAGER';
+-------+-------+-----------+-------+------------+--------+------+------+
| EmpNo | Ename | Job       | Sal   | Hiredate   | Deptno | MGR  | COMM |
+-------+-------+-----------+-------+------------+--------+------+------+
|  7002 | MASON | PRESIDENT | 11000 | 2005-06-06 |     20 | NULL |    0 |
|  7004 | JOHN  | MANAGER   |  6900 | 2005-08-06 |     10 | NULL |  500 |
+-------+-------+-----------+-------+------------+--------+------+------+
2 rows in set (0.00 sec)

mysql> select * from EMPLOYEE where Ename LIKE 'J%';
+-------+-------+---------+------+------------+--------+------+------+
| EmpNo | Ename | Job     | Sal  | Hiredate   | Deptno | MGR  | COMM |
+-------+-------+---------+------+------------+--------+------+------+
|  7004 | JOHN  | MANAGER | 6900 | 2005-08-06 |     10 | NULL |  500 |
+-------+-------+---------+------+------------+--------+------+------+
1 row in set (0.01 sec)

mysql> select * from EMPLOYEE where Ename LIKE '%A%';
+-------+-------+-----------+-------+------------+--------+------+------+
| EmpNo | Ename | Job       | Sal   | Hiredate   | Deptno | MGR  | COMM |
+-------+-------+-----------+-------+------------+--------+------+------+
|  7002 | MASON | PRESIDENT | 11000 | 2005-06-06 |     20 | NULL |    0 |
|  7005 | BLAKE | CLERK     |  4500 | 2005-09-06 |     30 | NULL |    0 |
+-------+-------+-----------+-------+------------+--------+------+------+
2 rows in set (0.00 sec)

mysql> select Sal, COMM, Sal+COMM Bonus from EMPLOYEE;
+-------+------+-------+
| Sal   | COMM | Bonus |
+-------+------+-------+
| 11000 |    0 | 11000 |
|  6900 |  500 |  7400 |
|  4500 |    0 |  4500 |
+-------+------+-------+
3 rows in set (0.00 sec)

mysql> select Sal, Sal+ Sal*0.10 increased from EMPLOYEE where Job = 'MANAGER';
+------+-----------+
| Sal  | increased |
+------+-----------+
| 6900 |   7590.00 |
+------+-----------+
1 row in set (0.00 sec)

mysql> update EMPLOYEE set Sal = Sal + (Sal*0.10) where Job = 'MANAGER';
Query OK, 1 row affected (0.01 sec)
Rows matched: 1  Changed: 1  Warnings: 0

mysql> select * from EMPLOYEE ORDER BY ENAME desc;
+-------+-------+-----------+-------+------------+--------+------+------+
| EmpNo | Ename | Job       | Sal   | Hiredate   | Deptno | MGR  | COMM |
+-------+-------+-----------+-------+------------+--------+------+------+
|  7002 | MASON | PRESIDENT | 11000 | 2005-06-06 |     20 | NULL |    0 |
|  7004 | JOHN  | MANAGER   |  7590 | 2005-08-06 |     10 | NULL |  500 |
|  7005 | BLAKE | CLERK     |  4500 | 2005-09-06 |     30 | NULL |    0 |
+-------+-------+-----------+-------+------------+--------+------+------+
3 rows in set (0.00 sec)

mysql> select * from EMPLOYEE ORDER BY DeptNo, Job;
+-------+-------+-----------+-------+------------+--------+------+------+
| EmpNo | Ename | Job       | Sal   | Hiredate   | Deptno | MGR  | COMM |
+-------+-------+-----------+-------+------------+--------+------+------+
|  7004 | JOHN  | MANAGER   |  7590 | 2005-08-06 |     10 | NULL |  500 |
|  7002 | MASON | PRESIDENT | 11000 | 2005-06-06 |     20 | NULL |    0 |
|  7005 | BLAKE | CLERK     |  4500 | 2005-09-06 |     30 | NULL |    0 |
+-------+-------+-----------+-------+------------+--------+------+------+
3 rows in set (0.00 sec)

mysql> select CONCAT(UPPER(SUBSTRING(Ename,1,1)) , LOWER(SUBSTRING(Ename,2)) ) Caps from EMPLOYEE;
+-------+
| Caps  |
+-------+
| Mason |
| John  |
| Blake |
+-------+
3 rows in set (0.01 sec)

mysql> select LOWER(Ename) LC from EMPLOYEE;
+-------+
| LC    |
+-------+
| mason |
| john  |
| blake |
+-------+
3 rows in set (0.00 sec)

mysql> select Ename, position("A" IN Ename) position from EMPLOYEE;
+-------+----------+
| Ename | position |
+-------+----------+
| MASON |        2 |
| JOHN  |        0 |
| BLAKE |        3 |
+-------+----------+
3 rows in set (0.00 sec)

mysql> select SUBSTRING(Ename, -3) from EMPLOYEE;
+----------------------+
| SUBSTRING(Ename, -3) |
+----------------------+
| SON                  |
| OHN                  |
| AKE                  |
+----------------------+
3 rows in set (0.00 sec)

mysql> select Ename, LENGTH(Ename) length from EMPLOYEE;
+-------+--------+
| Ename | length |
+-------+--------+
| MASON |      5 |
| JOHN  |      4 |
| BLAKE |      5 |
+-------+--------+
3 rows in set (0.00 sec)

mysql> select NOW();
+---------------------+
| NOW()               |
+---------------------+
| 2022-09-25 22:18:28 |
+---------------------+
1 row in set (0.00 sec)

mysql> select Ename, date_add(HireDate, interval 5 year) 5_year_mark from EMPLOYEE;
+-------+-------------+
| Ename | 5_year_mark |
+-------+-------------+
| MASON | 2010-06-06  |
| JOHN  | 2010-08-06  |
| BLAKE | 2010-09-06  |
+-------+-------------+
3 rows in set (0.01 sec)

mysql> select LAST_DAY(now()) LD;
+------------+
| LD         |
+------------+
| 2022-09-30 |
+------------+
1 row in set (0.00 sec)

mysql> select LAST_DAY(HireDate) LD_HD from EMPLOYEE;
+------------+
| LD_HD      |
+------------+
| 2005-06-30 |
| 2005-08-31 |
| 2005-09-30 |
+------------+
3 rows in set (0.00 sec)

mysql> select Ename, HireDate, timestampdiff(MONTH,HireDate,"2008-06-08") Diff_Months from EMPLOYEE;
+-------+------------+-------------+
| Ename | HireDate   | Diff_Months |
+-------+------------+-------------+
| MASON | 2005-06-06 |          36 |
| JOHN  | 2005-08-06 |          34 |
| BLAKE | 2005-09-06 |          33 |
+-------+------------+-------------+
3 rows in set (0.00 sec)

mysql> select Ename, Sal, IF(COMM IS NOT NULL, COMM, '99' ) IF_clause from EMPLOYEE ;
+-------+-------+-----------+
| Ename | Sal   | IF_clause |
+-------+-------+-----------+
| MASON | 11000 | 0         |
| JOHN  |  7590 | 500       |
| BLAKE |  4500 | 0         |
+-------+-------+-----------+
3 rows in set (0.00 sec)

mysql> drop table EMPLOYEE_BACK;
Query OK, 0 rows affected (0.01 sec)

mysql> select count(Ename) D10_C from EMPLOYEE where DeptNo = 10;
+-------+
| D10_C |
+-------+
|     1 |
+-------+
1 row in set (0.00 sec)

mysql> select Dname, count(Ename) count from EMPLOYEE join DEPARTMENT ON EMPLOYEE.DeptNo = DEPARTMENT.DeptNo group by Dname;
+-----------+-------+
| Dname     | count |
+-----------+-------+
| MARKETING |     1 |
| ACCOUNTS  |     1 |
| SALES     |     1 |
+-----------+-------+
3 rows in set (0.01 sec)

mysql> select Job,count(*) count from EMPLOYEE group by Job;
+-----------+-------+
| Job       | count |
+-----------+-------+
| PRESIDENT |     1 |
| MANAGER   |     1 |
| CLERK     |     1 |
+-----------+-------+
3 rows in set (0.00 sec)

mysql> select count(*) count from EMPLOYEE;
+-------+
| count |
+-------+
|     3 |
+-------+
1 row in set (0.01 sec)

mysql> select Ename from EMPLOYEE where Sal = (select max(Sal) Salary from EMPLOYEE);
+-------+
| Ename |
+-------+
| MASON |
+-------+
1 row in set (0.00 sec)

mysql> select Ename from EMPLOYEE where COMM = (select max(COMM) from EMPLOYEE);
+-------+
| Ename |
+-------+
| JOHN  |
+-------+
1 row in set (0.00 sec)

mysql> select Ename from EMPLOYEE where Sal = (select min(Sal) from EMPLOYEE);
+-------+
| Ename |
+-------+
| BLAKE |
+-------+
1 row in set (0.00 sec)

mysql> select Dname, avg(Sal) from EMPLOYEE join DEPARTMENT ON EMPLOYEE.DeptNo =  DEPARTMENT.DeptNo group by Dname;
+-----------+------------+
| Dname     | avg(Sal)   |
+-----------+------------+
| MARKETING | 11000.0000 |
| ACCOUNTS  |  7590.0000 |
| SALES     |  4500.0000 |
+-----------+------------+
3 rows in set (0.01 sec)

mysql> select Distinct(Job) from EMPLOYEE;
+-----------+
| Job       |
+-----------+
| PRESIDENT |
| MANAGER   |
| CLERK     |
+-----------+
3 rows in set (0.00 sec)

mysql> select DeptNo from EMPLOYEE group by DeptNo having count(*) > 3;
Empty set (0.00 sec)

mysql> select count(*) from EMPLOYEE group by DeptNo;
+----------+
| count(*) |
+----------+
|        1 |
|        1 |
|        1 |
+----------+
3 rows in set (0.00 sec)

mysql> select DeptNo, sum(Sal) Total from EMPLOYEE group by DeptNo;
+--------+-------+
| DeptNo | Total |
+--------+-------+
|     10 |  7590 |
|     20 | 11000 |
|     30 |  4500 |
+--------+-------+
3 rows in set (0.00 sec)

mysql> select Ename, Job, CASE
    -> WHEN Job = 'PRESIDENT' THEN 1
    -> WHEN Job = 'MANAGER' THEN 2
    -> WHEN Job = 'CLERK' THEN 3
    -> END AS 'Rank'
    ->  from EMPLOYEE;
+-------+-----------+------+
| Ename | Job       | Rank |
+-------+-----------+------+
| MASON | PRESIDENT |    1 |
| JOHN  | MANAGER   |    2 |
| BLAKE | CLERK     |    3 |
+-------+-----------+------+
3 rows in set (0.00 sec)

mysql> select Job, sum(Sal) from EMPLOYEE group by Job having count(*) > 1;
Empty set (0.00 sec)

mysql> select Ename, if(Sal-5000 > 0, 'Can be Deducted','Insufficient for Deduction') Result from EMPLOYEE;
+-------+----------------------------+
| Ename | Result                     |
+-------+----------------------------+
| MASON | Can be Deducted            |
| JOHN  | Can be Deducted            |
| BLAKE | Insufficient for Deduction |
+-------+----------------------------+
3 rows in set (0.00 sec)

mysql> create table EMPLOYEE_DUP like EMPLOYEE;
Query OK, 0 rows affected (0.02 sec)

mysql> select Ename from EMPLOYEE where Job = (select Job from EMPLOYEE where Ename = 'CLARK');
Empty set (0.00 sec)

mysql> select Ename from EMPLOYEE where Sal = (select Sal from EMPLOYEE where Ename='BLAKE');
+-------+
| Ename |
+-------+
| BLAKE |
+-------+
1 row in set (0.00 sec)

mysql> select Ename, Sal from EMPLOYEE where Sal > (select avg(Sal) from EMPLOYEE );
+-------+-------+
| Ename | Sal   |
+-------+-------+
| MASON | 11000 |
+-------+-------+
1 row in set (0.00 sec)

mysql> select Ename from EMPLOYEE join DEPARTMENT ON EMPLOYEE.DeptNo = DEPARTMENT.DeptNo where Loc = 'NEWYORK' OR Loc = 'CHICAGO';
+-------+
| Ename |
+-------+
| JOHN  |
| MASON |
+-------+
2 rows in set (0.00 sec)

mysql> select Ename, Sal from EMPLOYEE where Sal > ANY (select Sal from EMPLOYEE where Ename='BLAKE' OR Ename='CLARK' );
+-------+-------+
| Ename | Sal   |
+-------+-------+
| MASON | 11000 |
| JOHN  |  7590 |
+-------+-------+
2 rows in set (0.01 sec)

mysql> select Ename, (Sal + Sal*0.10) increment from EMPLOYEE JOIN DEPARTMENT ON EMPLOYEE.DeptNo = DEPARTMENT.DeptNo where Loc = 'CHICAGO';
+-------+-----------+
| Ename | increment |
+-------+-----------+
| MASON |  12100.00 |
+-------+-----------+
1 row in set (0.00 sec)

mysql> select * from EMPLOYEE where Sal > ANY (select avg(Sal) from EMPLOYEE group by DeptNo );
+-------+-------+-----------+-------+------------+--------+------+------+
| EmpNo | Ename | Job       | Sal   | Hiredate   | Deptno | MGR  | COMM |
+-------+-------+-----------+-------+------------+--------+------+------+
|  7002 | MASON | PRESIDENT | 11000 | 2005-06-06 |     20 | NULL |    0 |
|  7004 | JOHN  | MANAGER   |  7590 | 2005-08-06 |     10 | NULL |  500 |
+-------+-------+-----------+-------+------------+--------+------+------+
2 rows in set (0.00 sec)

mysql> select * from EMPLOYEE where Ename <> 'BLAKE' AND Ename != 'CLARK';
+-------+-------+-----------+-------+------------+--------+------+------+
| EmpNo | Ename | Job       | Sal   | Hiredate   | Deptno | MGR  | COMM |
+-------+-------+-----------+-------+------------+--------+------+------+
|  7002 | MASON | PRESIDENT | 11000 | 2005-06-06 |     20 | NULL |    0 |
|  7004 | JOHN  | MANAGER   |  7590 | 2005-08-06 |     10 | NULL |  500 |
+-------+-------+-----------+-------+------------+--------+------+------+
2 rows in set (0.00 sec)

mysql> create view emp_vw AS SELECT Ename, Sal, Job from EMPLOYEE where DeptNo = 10;
Query OK, 0 rows affected (0.01 sec)

mysql> create view emp_vw1 AS SELECT Ename, Sal, Job from EMPLOYEE join DEPARTMENT ON EMPLOYEE.DeptNo = DEPARTMENT.DeptNo where Loc = 'CHICAGO';
Query OK, 0 rows affected (0.00 sec)

mysql> create view emp_dept AS SELECT Ename, Job, Sal, Dname, Loc from EMPLOYEE join DEPARTMENT ON EMPLOYEE.DeptNo = DEPARTMENT.DeptNo;
Query OK, 0 rows affected (0.00 sec)

mysql>